{
  "schema_version": "3.0.0",
  "run_id": "run-1",
  "created_at": "2026-08-14T00:00:00+00:00",
  "source": {"revision": "abc123", "input_ref": "snapshot-1", "input_hash": "sha256:snapshot"},
  "executor": {"name": "agent-runtime", "version": "1.0.0"},
  "configuration_hash": "sha256:config",
  "environment": {"runtime": "ci"},
  "profile": null,
  "capture_policy": "metadata",
  "extensions": {}
}
